Staff Member ID,Project Title
1,stories 
1,Cthulhu Cthulhu Cthulhu Miskatonic myths society 
1,myths Dagon Dagon stories 
2,research worship Miskatonic myths Dagon mayhem Dagon 
2,mayhem stories myths stories myths 
2,app 
3,stories Cthulhu worship Cthulhu 
3,app worship worship Dagon Cthulhu 
3,mayhem app app Dagon worship 
4,Dagon Cthulhu Miskatonic Cthulhu myths Dagon 
4,research mayhem mayhem research worship app 
4,Cthulhu Dagon worship Miskatonic app society stories Cthulhu 
5,research Dagon society app Dagon 
5,stories research Cthulhu Miskatonic Miskatonic app myths 
5,Dagon mayhem Miskatonic myths Cthulhu 
6,stories society stories worship mayhem 
6,app stories 
6,mayhem Cthulhu 
7,Miskatonic Miskatonic Cthulhu mayhem worship Dagon Dagon 
7,society research Dagon mayhem 
7,Miskatonic society Cthulhu stories Miskatonic Dagon 
8,Dagon app society stories mayhem Miskatonic 
8,research stories 
8,worship society stories app worship worship worship Miskatonic 
9,Cthulhu stories Cthulhu society app app research myths 
9,app society worship mayhem 
9,worship myths Cthulhu stories worship Cthulhu 
10,worship Cthulhu 
10,myths stories app myths Miskatonic 
10,mayhem Miskatonic Cthulhu myths 
11,stories myths mayhem Cthulhu 
11,stories society 
11,myths 
12,myths Miskatonic mayhem app research Cthulhu 
12,Dagon myths mayhem myths worship society Dagon 
12,mayhem Miskatonic myths 
13,mayhem worship research 
13,Cthulhu Dagon society research 
13,Dagon myths society myths Miskatonic app Cthulhu research 
14,myths Cthulhu stories mayhem Miskatonic 
14,Dagon myths Miskatonic app 
14,mayhem 
15,Miskatonic myths 
15,worship society stories mayhem Dagon Cthulhu 
15,app stories Miskatonic Miskatonic Miskatonic research Miskatonic 
16,app stories Cthulhu mayhem stories myths mayhem 
16,Cthulhu stories mayhem society 
16,Dagon worship society Dagon 
17,Cthulhu myths myths stories research worship 
17,stories Miskatonic myths app 
17,app Miskatonic Miskatonic Miskatonic app Miskatonic research myths 
18,Miskatonic stories mayhem Miskatonic 
18,research stories society mayhem Cthulhu myths Dagon research 
18,stories mayhem Miskatonic Dagon Dagon Miskatonic society Miskatonic 
19,myths myths Miskatonic 
19,worship worship society Miskatonic app app 
19,myths research research society 
20,society society worship Cthulhu worship 
20,stories myths research 
20,Dagon myths society mayhem 
21,research research myths Cthulhu 
21,stories 
21,society 
22,research mayhem society worship Miskatonic Miskatonic society myths 
22,stories mayhem mayhem worship myths 
22,app Cthulhu 
23,Cthulhu myths myths 
23,myths research research Cthulhu research stories 
23,app Miskatonic research myths 
24,stories Miskatonic society mayhem mayhem app 
24,myths mayhem myths stories research society Miskatonic Cthulhu 
24,Dagon 
25,society Dagon stories Miskatonic app society 
25,worship mayhem worship society society 
25,Miskatonic stories mayhem worship mayhem worship Dagon 
26,mayhem Cthulhu Cthulhu stories 
26,myths stories Miskatonic research 
26,society 
27,app research myths worship 
27,stories 
27,Miskatonic Miskatonic stories Miskatonic 
28,app society worship worship Miskatonic 
28,Cthulhu Dagon Dagon 
28,Miskatonic mayhem worship Cthulhu research 
29,Miskatonic society Miskatonic Dagon myths research mayhem app 
29,stories stories Dagon stories research Cthulhu 
29,myths Cthulhu mayhem 
30,myths Dagon myths research Dagon Miskatonic Dagon 
30,worship society mayhem Cthulhu app 
30,mayhem app Dagon mayhem Dagon Miskatonic Dagon 
